id,title,score,created_utc
qf4oam,Recomendación de odontólogo?,0,1635120695.0
qf42rf,¿Locales de piezas y repuestos de bicicletas en Montevideo?,2,1635118636.0
qf3mcs,Experiencias coliving?,8,1635117091.0
qf3hzm,Arroyo del Vizcaíno: un yacimiento con más de 2.000 restos fósiles de la megafauna local,5,1635116679.0
qf3elk,"""Me cago en Lodran, voy a praiseonar el sol en la Plaza Virgilio""",12,1635116398.0
qf3by9,Offtopic pero hecho en UY y meme que necesitaba compartir,0,1635116152.0
qf3bb0,qué onda con Tinder,3,1635116092.0
qf397q,¿Donde está la comunidad balisong en Uruguay?,0,1635115898.0
qf3208,El perro nuevo del pepe,3,1635115274.0
qf2qtp,Manifiesto: la LUC no es Uruguay. ¿Para ustedes es 👍o👎?,1,1635114291.0
qf2mfp,Como esta el mercado laboral para ingenieros en el pais?,4,1635113894.0
qf1siv,Experiancias de rinoplastias,10,1635111315.0
qf0hy6,🍦,0,1635107429.0
qf0ex1,Qué opinan de Montblanc?,1,1635107177.0
qezlbp,Vamo Carrasco,36,1635104749.0
qeyntm,Jajaja,129,1635102061.0
qeybwt,Chivito uruguayo lo mejor del mundo,72,1635101083.0
qey83c,¡Hola a todos! Quiero realizar una encuesta en diferentes subreddits y ver cómo difieren los resultados.¿Se sienten seguros caminando solos de noche?,10,1635100774.0
qey2l1,Calidad servicio UTE,3,1635100330.0
qexnc3,Awanta boh,31,1635099094.0
qewp8n,"Invest now!! Meme template similar al de Drake, pero en el ámbito campestre uruguayo",11,1635096317.0
qevqgx,Algún lugar donde hagan pins personalizados chicos?,2,1635093380.0
qets28,Encontraron un cadáver a orillas del río Uruguay y presumen que se trata del empresario Eugenio Schneider,16,1635087441.0
qes75l,Toma del Hospital Filtro: recuerdos de una noche violenta que trajo resabios de dictadura,16,1635082200.0
qeo2qa,"No se si conocen una golosina muy famosa llamada Gansito de Marinela. Me acuerdo que se podía encontrar en todos lados pero ahora es al revés. Mi pregunta es: saben si sigue llegando al país? En caso de que si, saben donde se puede comprar?",8,1635064127.0
qenkoj,Todo culpa de rivera que líquido a los indígenas 😥,70,1635061731.0
qemz0k,Domingo random.,3,1635058925.0
qelwq2,Luna llena en Punta Negra,31,1635054042.0
qelpgn,Este atardecer entre lluvias me gusta más de lo que puedo explicarlo con palabras,17,1635053136.0
qekczx,Puchero Nuezini Arroyos,12,1635047577.0
qek43a,Marina norteamericana preparándose para venir al Río negro,28,1635046577.0
qeixnc,“Ofertas” de Devoto,35,1635041998.0
qeinpw,Tier List de YouTubers Uruguayos,0,1635040926.0
qeikc0,Sobre trabajo informal,7,1635040586.0
qeif8a,Es mucha plata 10K USD en Uruguay?,1,1635040024.0
qei1hp,Villa Española be like.,10,1635038578.0
qeh8wg,"Patada criminal sobre Facundo Torres, la sacó barata",75,1635035658.0
qeh83i,Mi primer aporte,54,1635035569.0
qegzhl,"According to a recent poll, 63% disagree with raising the retirement age to 65, with the highest portion of this disagreement coming from the lower and middle classes:",1,1635034704.0
qef7s4,Alguien sabe que es eso? Se ve en el horizonte mirando hacia el puerto...,14,1635028640.0
qedc9g,"20 minutos de diferencia entre las fotos, Piriápolis",76,1635022533.0
qedc3r,Me enteré que si cobras $175k nominales te descuentan $70k del salario,61,1635022518.0
qedb77,OSE llama a cubrir 229 puestos zafrales. El salario es de 32.880 pesos,15,1635022440.0
qecfvn,Inspirado en otros memes,11,1635019654.0
qec60s,Cuando estás comiendo un Ricardito y te acordás cuando el Dr. Light se vistió de Ryu.,16,1635018811.0
qeaqtl,*le mete una bombilla,21,1635014462.0
qea7b9,República completa más yapa,259,1635012824.0
qe9tr8,Los corrales de palmas de Rocha y el origen del manejo ganadero en Uruguay,5,1635011666.0
qe9l4p,Inauguró en Montevideo la primera cafetería uruguaya para sordos,12,1635010915.0
qe9gik,Cuál es el mejor refresco (estilo Coca) más saludable?,2,1635010525.0
qe91e0,Es finter,11,1635009261.0
qe8zem,Evil Minas be like,54,1635009097.0
qe8i49,Que paso con el tipo que se inmolo? (gustavo cano),10,1635007653.0
qe7gtt,Consulta sobre VPNs,5,1635004510.0
qe76av,18 de Julio y Herrera y Obes - 1967,108,1635003612.0
qe5x4x,Vale más el fútbol que el trabajo?????,15,1634999381.0
qe5gzz,Defensa declaró “información reservada por 15 años” actas militares sobre Armando Méndez,11,1634997874.0
qe5d68,Volvió papá,56,1634997581.0
qe5865,El biscuit del mal,0,1634996657.0
qe4xm6,Evil oficialismo be like,70,1634995625.0
qe38vf,Donde encuentro el mejor struddel de manzana en Montevideo? (me encuentro por cordón).,5,1634989058.0
qe1v0x,"Un gran error, y una disculpa gigante",3,1634982549.0
qdzuvg,Sábado de arte.,7,1634972524.0
qdzi09,Que haces en reddit a esta hora?,0,1634970894.0
qdxl7r,data scientist,7,1634962508.0
qdwhu2,autoeliminaciòn?,31,1634958243.0
qdv0f9,"Gente, eh visto varios grafitis por Montevideo y hasta en punta del este mostrando estos hongos con alas y un ojo, que significan o quién los hace?",7,1634952532.0
qdudh1,Fallé épicamente pasando mi número a una chica y vengo a desahogarme,93,1634950165.0
qdt22z,Ayuda elegir qué celular comprar !!!!,1,1634945483.0
qdrh0m,"Alguno es actualmente, o tuvo padres sobreprotectores? 🥶🥶",25,1634940374.0
qdr6xj,El día que Menem casi muere y la millonaria oferta para cambiar una respuesta de su última entrevista,2,1634939523.0
qdpsin,Como la ven? Salida al caribe coso,45,1634935285.0
qdom9d,"RMA de Asus, Amd, Gigabyte desde Uruguay?",2,1634931732.0
qdo1vw,"Es coreano, superó las crisis argentinas y hoy su termo ""inteligente"" busca conquistar Uruguay",11,1634930077.0
qdm0zn,Ellos antes.,133,1634924184.0
qdl6xk,[Natación] El olímpico Enzo Martí­nez decidió retirarse del alto rendimiento,7,1634921794.0
qdktp7,[RANT] La atención que se la de a Argentina da vergüenza ajena monumental,47,1634920716.0
qdka4c,[Fútbol] La selección femenina le ganó 3-0 a Boca Juniors,13,1634919181.0
qdjuju,Que es Flores?,7,1634917954.0
qdjrxw,"Políticos argentinos, peores que los uruguayos?",0,1634917736.0
qdj9kz,Qué dijo Alfie sobre la posibilidad de bajar el IRPF en este período de gobierno,5,1634916259.0
qdj5or,Disfraz para Halloween??,2,1634915943.0
qdiv8o,Visto en Twitter ( fuente en comentarios ),94,1634915118.0
qd4m8i,Precio de otoplostia en Uruguay,5,1634860399.0
qd39l9,Tiren preguntas para mi proyecto!!,2,1634855938.0
qd911z,Jodas en Montevideo,1,1634876009.0
qdhqay,Entro en el top y vos?,51,1634911722.0
qdhktd,Atardecer en parque minamar,21,1634911259.0
qdhf2x,"Orlando Petinatti reveló a quién votó y añadió: ""Me da pena que me digan facho""",9,1634910782.0
qdh4tz,Vivienda sube la apuesta y pide más de U$S 200 millones para el fideicomiso de erradicación de asentamientos,5,1634909888.0
qdh44o,En cuanto me puedo recibir en la fing?,0,1634909826.0
qdg029,Extender señal wifi,2,1634906207.0
qdew1m,Ocho meses de formación y sueldo de $40.000. Las oportunidades para ser programador,0,1634902136.0
qderf8,Procesaron con prisión al militar retirado Armando Méndez por el asesinato de Gerardo Alter,19,1634901620.0
qde7la,Danubio festejó con lo justo,3,1634899424.0
qdbcge,Viernes de legislación.,4,1634886124.0
qdabr8,"QUIERO RECARGAR $1500 EN LA CUENTA STEAM POR REDPAGOS, CUANTO ME COBRARA DE COMISION ?",0,1634881504.0
qd81to,NOOOO ESTA VEZ LE TOCÓ A AGUSTÍN!,13,1634872307.0
qd5x6d,Argimón dijo que hay “mucho de medio verdades o de mentiras” en la campaña contra la LUC,3,1634864878.0
qd5suy,Campo but still Montevideo.,15,1634864481.0
